{
  "id": "floating-island-sunset",
  "title": "Floating Island Sunset",
  "summary": "Classic Japanese animation style - floating islands with cottages and waterfalls in a warm sunset sky.",
  "category": "landscape-scene",
  "prompt": "A breathtaking classic Japanese animation landscape: several small floating islands drifting in a warm sunset sky. Each island has lush trees, tiny waterfalls cascading off the edges into clouds below, miniature wooden cottages with golden window light. Hot air balloon in the distance. Sky painted in dramatic peach, gold, and lavender. Painterly anime style, soft cel-shading, square 16:9 ratio. Sense of wonder and serenity.",
  "modelHint": "gemini-2.5-flash-image",
  "tags": [
    "landscape",
    "fantasy",
    "anime",
    "sunset",
    "floating-islands"
  ],
  "ageRating": "4+",
  "version": "1.0.1",
  "previewURL": "https://storage.googleapis.com/mchatai-2367e.firebasestorage.app/prompt-previews/dreamsnap/floating-island-sunset/preview.png",
  "previewThumbURL": "https://storage.googleapis.com/mchatai-2367e.firebasestorage.app/prompt-previews/dreamsnap/floating-island-sunset/thumb.png",
  "audioPreviewURL": null,
  "previewDurationSec": null,
  "promptVariables": null
}
