{
  "id": "lofi-cafe-jazz",
  "title": "Lo-Fi Cafe Jazz",
  "summary": "Laid-back 84 BPM cafe instrumental with smooth jazz guitar, Rhodes, and mellow saxophone.",
  "category": "lofi",
  "prompt": "A laid-back lo-fi cafe instrumental at 84 BPM. Smooth jazz guitar chords, warm Rhodes piano comping, mellow saxophone melody on top, soft brushed snare and kick groove, light upright bass. Hint of cafe ambience, gentle vinyl warmth. Effortless and inviting, like a Sunday brunch playlist.",
  "modelHint": "google/lyria-3-pro-preview",
  "tags": [
    "lofi",
    "jazz",
    "cafe",
    "instrumental",
    "smooth"
  ],
  "ageRating": "4+",
  "version": "1.0.0",
  "previewURL": null,
  "previewThumbURL": null,
  "audioPreviewURL": "https://storage.googleapis.com/mchatai-2367e.firebasestorage.app/prompt-previews/audio-library/lofi-cafe-jazz/preview.m4a",
  "previewDurationSec": 15,
  "promptVariables": null
}
