{
  "id": "retro-camera-sticker",
  "title": "Retro Camera Sticker",
  "summary": "Single die-cut sticker of a mint-and-cream vintage TLR camera, 1970s graphic vibe.",
  "category": "sticker-style",
  "prompt": "A single die-cut sticker design of a vintage twin-lens reflex camera (TLR style) in soft mint-green and cream, rendered in flat vector illustration with a thick white sticker border and subtle drop shadow. Tiny stars and dotted-line motion arcs around it suggesting a click-and-snap. Cheerful retro 1970s graphic-design vibe. White background, centered, square 1:1 composition.",
  "modelHint": "gemini-2.5-flash-image",
  "tags": [
    "sticker",
    "camera",
    "vintage",
    "retro",
    "vector"
  ],
  "ageRating": "4+",
  "version": "1.0.0",
  "previewURL": "https://storage.googleapis.com/mchatai-2367e.firebasestorage.app/prompt-previews/dreamsnap/retro-camera-sticker/preview.png",
  "previewThumbURL": "https://storage.googleapis.com/mchatai-2367e.firebasestorage.app/prompt-previews/dreamsnap/retro-camera-sticker/thumb.png",
  "audioPreviewURL": null,
  "previewDurationSec": null,
  "promptVariables": null
}
