{
  "id": "tropical-coral-reef-fish",
  "title": "Tropical Coral Reef Fish",
  "summary": "Underwater school of neon-yellow tang and parrotfish over electric-pink coral.",
  "category": "landscape-scene",
  "prompt": "An underwater wildlife photograph of a thriving tropical coral reef: a swirling school of neon-yellow tang fish, a regal angelfish, and a colorful parrotfish gliding over a bed of electric-pink, lavender, and orange coral formations. Crystal-clear turquoise water with shafts of sunlight piercing down from the surface. Hyper-realistic underwater photography, full-frame DSLR with strobe lighting, vibrant National Geographic aesthetic. Square 1:1.",
  "modelHint": "gemini-2.5-flash-image",
  "tags": [
    "wildlife",
    "underwater",
    "coral",
    "vibrant",
    "tropical"
  ],
  "ageRating": "4+",
  "version": "1.0.0",
  "previewURL": "https://storage.googleapis.com/mchatai-2367e.firebasestorage.app/prompt-previews/dreamsnap/tropical-coral-reef-fish/preview.png",
  "previewThumbURL": "https://storage.googleapis.com/mchatai-2367e.firebasestorage.app/prompt-previews/dreamsnap/tropical-coral-reef-fish/thumb.png",
  "audioPreviewURL": null,
  "previewDurationSec": null,
  "promptVariables": null
}
