{
  "id": "cyberpunk-character-portrait",
  "title": "Cyberpunk Character Portrait",
  "summary": "Hyper-detailed character portrait - holographic visor, neon facial paint, chrome augments.",
  "category": "character-portrait",
  "prompt": "An ultra-detailed cyberpunk character portrait: a young person in dramatic three-quarter profile wearing a holographic translucent visor reflecting magenta and cyan, neon UV facial paint streaks, chrome cybernetic temple augments, an undercut hairstyle in electric teal. Backlit by a rainy Tokyo neon sign. Cinematic film-still composition, 85mm portrait lens, noir science-fiction cyberpunk aesthetic. Hyper-realistic skin and material detail.",
  "modelHint": "gemini-2.5-flash-image",
  "tags": [
    "character",
    "cyberpunk",
    "portrait",
    "neon",
    "futuristic"
  ],
  "ageRating": "12+",
  "version": "1.0.1",
  "previewURL": "https://storage.googleapis.com/mchatai-2367e.firebasestorage.app/prompt-previews/dreamsnap/cyberpunk-character-portrait/preview.png",
  "previewThumbURL": "https://storage.googleapis.com/mchatai-2367e.firebasestorage.app/prompt-previews/dreamsnap/cyberpunk-character-portrait/thumb.png",
  "audioPreviewURL": null,
  "previewDurationSec": null,
  "promptVariables": null
}
