{
  "id": "anime-action-hero-pose",
  "title": "Anime Action Hero Pose",
  "summary": "Dynamic anime hero - sword drawn mid-leap, sparks, dramatic speed lines, sunset sky.",
  "category": "character-portrait",
  "prompt": "A dynamic anime action-hero illustration: a young protagonist with a windswept silver coat mid-leap, drawing a glowing katana through the air, golden energy sparks trailing from the blade, dramatic speed lines radiating from the action. Vivid sunset sky with magenta clouds and a single moon. Bold cel-shaded modern Japanese animation style with vibrant color blocking and clean ink lines. Cinematic low-angle composition. Square 1:1.",
  "modelHint": "gemini-2.5-flash-image",
  "tags": [
    "anime",
    "action",
    "character",
    "vibrant",
    "hero"
  ],
  "ageRating": "9+",
  "version": "1.0.1",
  "previewURL": "https://storage.googleapis.com/mchatai-2367e.firebasestorage.app/prompt-previews/dreamsnap/anime-action-hero-pose/preview.png",
  "previewThumbURL": "https://storage.googleapis.com/mchatai-2367e.firebasestorage.app/prompt-previews/dreamsnap/anime-action-hero-pose/thumb.png",
  "audioPreviewURL": null,
  "previewDurationSec": null,
  "promptVariables": null
}
