{
  "id": "reggae-island-chill",
  "title": "Reggae Island Chill",
  "summary": "76 BPM classic reggae - off-beat guitar skanks, deep walking bass, horn melody, island vibe.",
  "category": "by-genre",
  "prompt": "A laid-back classic reggae instrumental at 76 BPM. Off-beat clean guitar skanks on the upstroke, deep walking electric bass underpinning the groove, one-drop drum pattern with the kick on the 3, warm Hammond organ swells, melodic horn-section line (sax + trumpet). Classic 70s Caribbean reggae groove - relaxed, sun-soaked, instrumental.",
  "modelHint": "google/lyria-3-pro-preview",
  "tags": [
    "reggae",
    "island",
    "chill",
    "instrumental",
    "classic"
  ],
  "ageRating": "4+",
  "version": "1.0.1",
  "previewURL": null,
  "previewThumbURL": null,
  "audioPreviewURL": "https://storage.googleapis.com/mchatai-2367e.firebasestorage.app/prompt-previews/audio-library/reggae-island-chill/preview.m4a",
  "previewDurationSec": 15,
  "promptVariables": null
}
