{
  "id": "techno-driving",
  "title": "Driving Techno",
  "summary": "130 BPM Berlin-style techno - punchy four-on-floor, hypnotic synth stab, deep warehouse mood.",
  "category": "by-genre",
  "prompt": "A driving Berlin warehouse-techno instrumental at 130 BPM. Punchy four-on-the-floor kick with reverb tail, off-beat open hi-hat, hypnotic minor-key synth stab repeating, deep sub-bassline, occasional sweeping noise risers, sparse vocal-snippet processed through delay. Cold industrial atmosphere - Berghain / Drumcode lineage. Relentlessly forward-moving.",
  "modelHint": "google/lyria-3-pro-preview",
  "tags": [
    "edm",
    "techno",
    "berlin",
    "instrumental",
    "warehouse"
  ],
  "ageRating": "9+",
  "version": "1.0.0",
  "previewURL": null,
  "previewThumbURL": null,
  "audioPreviewURL": "https://storage.googleapis.com/mchatai-2367e.firebasestorage.app/prompt-previews/audio-library/techno-driving/preview.m4a",
  "previewDurationSec": 15,
  "promptVariables": null
}
