{
  "id": "cinematic-trailer-epic",
  "title": "Cinematic Trailer (Epic)",
  "summary": "Hans-Zimmer-style 90s trailer build  -  taikos, brass stabs, choir swells, big braam climax.",
  "category": "instrumental",
  "prompt": "An epic cinematic film-trailer score, 90 seconds of escalating tension. Starts with sparse low piano and string drone, builds with rising cellos and pulsing taiko drums, dramatic brass stabs at the climax, choir \"aah\" swells, big braam hits. Modern Hans Zimmer / Two Steps From Hell style. Triumphant, awe-inspiring.",
  "modelHint": "google/lyria-3-pro-preview",
  "tags": ["cinematic", "trailer", "epic", "orchestral", "instrumental"],
  "ageRating": "4+",
  "version": "1.0.0",
  "previewURL": null,
  "previewThumbURL": null,
  "audioPreviewURL": null,
  "previewDurationSec": null,
  "promptVariables": null
}
