{
  "id": "cozy-holiday-card",
  "title": "Cozy Holiday Card",
  "summary": "Storybook winter scene with a snowy cabin, woodland animals, and a single bright star.",
  "category": "greeting-card",
  "prompt": "A cozy winter holiday card. A small woodland scene: a tiny cabin with warm yellow window light, snow-covered pine trees, a fox and a rabbit standing in fresh snow looking at the cabin. Soft falling snowflakes, deep blue twilight sky with a single bright star. Painted in a storybook illustration style with warm muted colors. \"Warmest Wishes\" in handwritten script at the bottom.",
  "modelHint": "gemini-2.5-flash-image",
  "tags": [
    "holiday",
    "winter",
    "card",
    "cozy",
    "storybook"
  ],
  "ageRating": "4+",
  "version": "1.0.0",
  "previewURL": "https://storage.googleapis.com/mchatai-2367e.firebasestorage.app/prompt-previews/dreamsnap/cozy-holiday-card/preview.png",
  "previewThumbURL": "https://storage.googleapis.com/mchatai-2367e.firebasestorage.app/prompt-previews/dreamsnap/cozy-holiday-card/thumb.png",
  "audioPreviewURL": null,
  "previewDurationSec": null,
  "promptVariables": null
}
