{
  "id": "astronaut-cat",
  "title": "Astronaut Cat",
  "summary": "Photo-real ginger tabby in a custom astronaut suit, floating against a nebula.",
  "category": "cute-creature",
  "prompt": "A photo-realistic ginger tabby cat in a tiny custom-fit white astronaut suit with a glass-bubble helmet, floating in zero gravity. Inside the helmet the cat has a curious wide-eyed expression. Background: deep cosmic space with a swirl of pink and purple nebula, distant galaxies, scattered stars, planet Earth softly out of focus below. Cinematic NASA-photo lighting, hyper-detailed fur, square 1:1 composition.",
  "modelHint": "gemini-2.5-flash-image",
  "tags": [
    "cat",
    "astronaut",
    "space",
    "photorealistic",
    "nebula"
  ],
  "ageRating": "4+",
  "version": "1.0.0",
  "previewURL": "https://storage.googleapis.com/mchatai-2367e.firebasestorage.app/prompt-previews/dreamsnap/astronaut-cat/preview.png",
  "previewThumbURL": "https://storage.googleapis.com/mchatai-2367e.firebasestorage.app/prompt-previews/dreamsnap/astronaut-cat/thumb.png",
  "audioPreviewURL": null,
  "previewDurationSec": null,
  "promptVariables": null
}
